{
  "goal": "在本机将全部已保存的记账记录导出为 UTF-8 CSV，字段依次为日期、金额、分类。",
  "scope": [
    "确认目标项目、现有记录存储方式和导出入口。",
    "实现从完整已保存数据集读取记录并导出，避免被界面分页或当前页数据限制。",
    "生成 UTF-8 CSV，表头依次为日期、金额、分类，正确处理字段中的逗号、双引号和换行。",
    "依据项目现有结构完成相关验证，并返回变更位置、实际检查方法及结果。"
  ],
  "non_goals": [
    "新增云服务或云端存储。",
    "增加与本次 CSV 导出无关的功能。"
  ],
  "implementation_constraints": [
    "在本机完成导出，不将记账数据上传到新增外部服务。",
    "保持日期和金额既有的业务语义及金额精度。",
    "先检查真实项目环境，不假定数据库、框架、文件路径或测试命令。"
  ],
  "acceptance_criteria": [
    "CSV 包含全部已保存记录，每条记录恰好出现一次。",
    "字段及顺序为日期、金额、分类。",
    "文件采用 UTF-8 编码，中文及 CSV 特殊字符可正确解析。",
    "导出操作不改变已保存的记账记录。"
  ],
  "verification": [
    {
      "check": "使用已知完整数据集导出，再用 CSV 解析器比较记录数量和内容，确认无遗漏、无重复且不受分页影响。",
      "required": true
    },
    {
      "check": "检查 UTF-8 编码、表头顺序，并验证中文、逗号、双引号和换行字段可正确往返解析。",
      "required": true
    },
    {
      "check": "比较导出前后的已保存记录，确认内容未被修改。",
      "required": true
    },
    {
      "check": "由 Codex 检查项目配置，确定并运行对应测试；返回实际命令、输出及未验证项。",
      "required": true
    }
  ]
}
